ID,Esai,Gaya Belajar,Tipe Kepribadian,,
26,"Saya biasa belajar setiap hari Rabu-Sabtu di kamar saya dengan suasana yang hening, saya lebih suka belajar sendiri karena bisa lebih fokus | dengan cara dijelaskan oleh guru/orang lain lalu saya pelajari lagi dan saya rangkum, lalu saya perdalam lagi dengan cara berlatih melalui latihan soal dsb | setelah saya coba belajar di lingkungan yang ramai, saya pikir saya lebih fokus untuk belajar di lingkungan yang tenang karena menurut saya tidak gampang terganggu dengan materi yang sedang saya pelajari  | saat saya menghadapi kesulitan dalam belajar saya mencoba untuk mencari solusi terlebih dahulu dengan cara mencari di internet, namun jika masih belum memahami saya akan meminta bantuan guru saya untuk menjelaskan  | Dari pengalaman belajar selama ini, saya menyadari bahwa saya adalah tipe pelajar yang dapat belajar dengan sks (sistem kebut semalam). Saya juga menyadari bahwa saya lebih dapat memahami materi dengan cara merangkumnya. Namun, saya juga menyadari kelemahan saya, yaitu mudah terdistraksi oleh ponsel saya. 

Oleh karena itu saya ingin mengubah cara belajar saya, yakni dengan membatasi waktu bermain ponsel saat jam belajar saya. Sementara itu, hal yang ingin saya pertahankan adalah kebiasaan membuat jadwal belajar yang terstruktur karena sangat membantu manajemen waktu saya.

Saat berada di lingkungan belajar baru, sikap saya adalah tetap terbuka, mudah beradaptasi, dan proaktif. Saya akan berusaha cepat akrab dengan teman-teman baru, mengamati norma atau aturan kelas yang berlaku, serta tidak ragu untuk bertanya kepada guru atau teman jika ada hal yang belum saya pahami",R,Ekstrovert,,
27,"kebiasaan belajar ku lebih ke individual. karna saya lebih fokus sendirian dengan pikiran saya daripada bersama orang lain. karna saya seorang INTJ. saya lebih memilih belajar di tempat yang sepi dan sunyi daripada ramai (ex : kafe, restoran,dll)  | cara saya memahami materi dengan mengulang materi, mencari poin² penting, dan mengerjakan latihan² soal dari materi tsb. saya cenderung memahami secara individual jika dirasa belum cukup dipahami saya akan bertanya pada teman/guru/orang yang memang paham di bidang nya. | kondisi belajar yang hening, sunyi, dan sepi adalah kondisi yang membuat saya fokus pada diri saya sendiri, fokus saya akan terpecah jika berada di lingkungan yang ramai. | ketika saya dihadapkan dengan kondisi dimana saya mengalami kesulitan dalam belajar, seperti (belum paham materi, susah memahami, bingung&lupa dalam mendalami materi) saya akan bertanya karna saya merasa sudah tidak yakin dengan diri saya. saya akan meminta bantuan jika saya benar benar membutuhkan nya. | yang saya pelajari mengenai diri saya bahwa saya sering merasa bingung jika dihadapkan dalam sesuatu kondisi dimana saya harus memutuskan sesuatu (anti komitmen club) juga saya merasa sering kecewa dalam menghadapi suatu hal. yang ingin aku ubah dari diri saya adalah rasa malas, dan rasa ragu terhadap diri saya sendiri. jika di hadapkan dengan lingkungan belajar yang baru maka saya akan lebih mudah berbaur dan beradaptasi dengan pembaruan yang ada. ",K,Introvert,,
28,"Kebiasaan belajarku sehari-hari biasanya dilakukan pada malam hari setelah semua kegiatan selesai. Aku lebih sering belajar di kamar karena suasananya lebih tenang dan membuatku lebih fokus. Saat belajar, suasana di sekitarku cenderung sepi, meskipun kadang masih terdengar suara televisi atau aktivitas keluarga dari luar kamar. Aku biasanya mulai belajar dengan mengulang materi yang sudah diajarkan di sekolah, lalu mengerjakan tugas atau latihan soal. Aku lebih nyaman belajar sendiri karena bisa lebih fokus dan mengatur waktu sesuai keinginanku. Belajar sendiri juga membuatku lebih mudah memahami materi dengan caraku sendiri tanpa terganggu obrolan. Namun, sesekali aku juga suka belajar bersama teman jika ada materi yang sulit. | Cara saya memahami materi pelajaran baru biasanya dimulai dengan membaca atau melihat gambaran umumnya terlebih dahulu supaya tahu inti materi yang akan dipelajari. Setelah itu, saya mencoba mendengarkan penjelasan guru dengan fokus dan mencatat poin-poin penting yang menurut saya sulit atau perlu diingat. Langkah berikutnya, saya biasanya mencoba mengerjakan soal latihan. Saya lebih nyaman memahami materi melalui kombinasi mendengarkan penjelasan orang lain dan belajar mandiri. Mendengarkan penjelasan guru atau teman membantu saya memahami dasar materinya dengan lebih cepat, sedangkan belajar mandiri membuat saya lebih bebas mengulang bagian yang belum dipahami. | Kondisi belajar yang paling aku sukai adalah suasana yang tenang dan sepi karena membuatku lebih mudah fokus. Biasanya aku belajar di kamar atau di tempat yang minim gangguan suara. Di sekitarku biasanya hanya ada meja belajar, buku, laptop atau handphone untuk mencari materi. Kadang aku juga mendengarkan musik pelan agar lebih rileks saat belajar. Aku merasa suasana yang sepi cocok untukku karena aku jadi lebih mudah memahami materi dan tidak terdistraksi oleh hal-hal di sekitar. Saat keadaan tenang, aku bisa lebih berkonsentrasi, berpikir dengan jelas, dan menyelesaikan tugas dengan lebih cepat. Dibandingkan lingkungan yang ramai, aku lebih bersemangat belajar di tempat yang tenang karena pikiranku terasa lebih rileks dan tidak mudah terpecah fokusnya. Dengan suasana seperti itu, aku jadi lebih mudah memahami pelajaran dan hasil belajarku terasa lebih maksimal. | Ketika menghadapi kesulitan atau tantangan dalam belajar, biasanya aku mencoba memahami dulu bagian mana yang belum aku mengerti. Aku akan membaca ulang materi, melihat contoh soal, atau mencari penjelasan dari internet dan video pembelajaran agar lebih paham. Kalau masih sulit, aku mencoba mengerjakan secara perlahan. Biasanya aku juga mencari solusi dengan berdiskusi bersama teman atau bertanya kepada guru. Menurutku, mendengarkan penjelasan dari orang lain kadang membuat materi yang sulit jadi lebih mudah dimengerti. Aku lebih sering mencoba menyelesaikannya sendiri terlebih dahulu karena ingin melatih kemampuan berpikir dan memahami materi secara mandiri. Namun, jika setelah mencoba tetap belum paham, aku tidak ragu untuk meminta bantuan orang lain.  | Dari pengalaman belajar selama ini, aku menyadari kalau aku lebih mudah fokus saat suasana tenang dan memahami materi dengan belajar mandiri terlebih dahulu. Aku juga termasuk orang yang cukup teliti dan suka mencoba memahami sampai benar-benar paham. Yang ingin aku pertahankan adalah kebiasaan belajar rutin, sedangkan yang ingin aku ubah adalah kebiasaan menunda belajar saat merasa malas. Saat berada di lingkungan belajar baru, aku biasanya mencoba beradaptasi dengan tenang, memperhatikan suasana sekitar, dan mulai mengenal teman-teman baru sedikit demi sedikit.",R,Introvert,,
29,"Saya suka belajar bareng bareng, biasanya aku belajar bareng teman teman, sering juga sendiri. Saya kalau belajar yang penting ada manisan | Saya harus mengulang materi secara mandiri dan melakukan pendalaman saat weekend, kalau tidak begitu saya akan terus tertinggal | Suka banget kalau suasananya berisik tapi terkendali, sering juga saya setel musik pop rock untuk meramaikan | Rasa malas  | Harus lebih rajin, sering ulang materi",K,Ekstrovert,,
30,Saya lebih nyaman belajar bersama dengan teman karena sangat menyenangkan  | Biasanya saya lebih paham saat melakukan sesi diskusi | Tidak saya cenderung ke lingkungan yang tenang | Tidak saya lebih sering mengerjakan sendiri | Mengikuti apa yang terjadu,R,Ekstrovert,,
31,"belajar saat mau ujian saja,ramai, berisik,tenang,lebih menyenangkan bersama orang lain karena bisa saling bertukar pikiran | mengulangi materi tersebut,mendengarkan penjelasan dari orang lain | suasana tenang,sepi,tidak berisik | istirahat sebentar agar otak tidak terjadi stres | sebagai belajar tentu yang harus kita lakukan adalah belajar,rajin membaca memahami dan mencoba hal baru",K,Ekstrovert,,
32,"Bersama orang lain karna kalo kurang paham bisa bertanya,belajar yang nyaman ada di rumah karna lebih nyantai | mendengarkan kan penjelasan dari orang lain karna lebih mudah di paham i  | tergantung,kadang suka yang ramai dan yang tenang | saya selalu mencoba menyelesaikan sendiri ketika diri sendiri merasa kurang paham maka bertanya ke pada rekan  | lebih suka belajar dengan tenang,cara berpikir,selalu beradaptasi ",R,Ekstrovert,,
33,"belajar jika ada pr dan belajar di malam hari | cara memahami materi dengan cara membuat catatan rangkuman sendiri lalu di pelajari dengan seksama | suasana belajar fav ialah dengan tenang, damai | ya sering meminta bantuan kpd teman | belajar beradaptasi ",K,Ekstrovert,,
34,"Saya keseharian saat belajar lebih suka sendiri, dan suasana saat belajar aku lebih cenderung di ketenangan | Ya pokok nya materi materi aku lebih cenderung suka mendengar kan penjelasan orang lain terlebih dahulu | Yang bisa membantu di sekitar saya yaitu hanya kedokusan diri sendiri | Sangat berat  | Tentang saya sendiri cara ubah atau cara belajar saya yaitu sangat mudah",A,Ekstrovert,,
35,sya lbih suka belajar sendiri sambil mendengarkan musik dan suasana yg tenang | diskusi dan penjelasan dari orang lain sya lebih suka dari pada belajar mandiri | suasana tenang dan diiringi music  | sya akan mencoba semaksimal mungkin setelah itu kalo tdk bisa baru mencari bantuan | menyenangkan dan sngat suka,K,Ekstrovert,,
36,"malam hari setelah pulang latihan, di kos sih sendirian soalnya kalo sma temen nnti ga belajar, yg ada mlh main | jujur lebih paham klo 4 mata sih, mendengarkan pelajaran  | sepi tenang, soalnya gampang ke distrek | selesaiin sendiri lah, aku orangnya ngga enakan takut ngrepotin, kalo sendiri ga bisa ya udah pasrah | masih moodyan sih kalo mau belajar, mungkin kedepannya bisa memaksakan suapaya bisa konsisten untuk belajar",K,Introvert,,
37,"saya lebih nyaman belajar sendiri karena lebih tenang dirumah pada saat selesai aktivitas atau pekerjaan rumah maupun diluar rumah. | saya lebih suka mendengarkan penjelasan orang lain dan ketika saya tidak paham saya akan mencari contoh contoh soal tentang materi itu tersebut. | saya lebih suka suasana tenang karna saat suasana tenang pikiran dan cara berfikir lebih santai dan ga terburu buru. | saya tida sering meminta bantuan kepada orang lain selagi saya bisa sendiri,jika saya menghadapi kesulitan dan tantangan saya biasanya bertanya kepada guru bimble saya atau temen yang sudah paham. | saya akan mempertahankan dengan kebiasaan yang membuat ku nyaman saat belajar seperti ditempat yang sepi dan tenang.",K,Ekstrovert,,
38,"Saya biasanya belajar pada sore atau malam hari di kamar yang tenang untuk menjaga fokus | 1. Membaca Cepat dan Menandai (Skimming
2. Belajar Mandiri untuk Menguasai Konsep Inti | Saya paling fokus belajar di ruangan yang tenang dan sejuk dengan pencahayaan alami, seperti di sudut kamar  | Saat menghadapi kesulitan belajar, saya selalu berusaha menganalisis masalahnya secara mandiri terlebih dahulu. 
 | Loss",R,Ekstrovert,,
39,"Saya biasanya belajar pada sore atau malam hari setelah selesai melakukan aktivitas sekolah dan istirahat. Tempat yang paling sering saya gunakan untuk belajar adalah di kamar atau ruang belajar karena suasananya lebih tenang dan membuat saya lebih fokus. Saat belajar, lingkungan di sekitar saya biasanya cukup nyaman, meskipun terkadang ada sedikit suara dari televisi atau aktivitas keluarga. Saya lebih nyaman belajar sendiri karena bisa lebih fokus, mengatur waktu sendiri, dan memahami materi dengan cara yang sesuai dengan kemampuan saya. Namun, sesekali saya juga belajar bersama teman ketika ada tugas kelompok atau materi yang sulit dipahami agar bisa saling bertukar pendapat. | Saat mendapatkan materi pelajaran baru, saya biasanya mulai dengan membaca dan memahami penjelasan dasar terlebih dahulu. Setelah itu, saya mencoba mencatat poin-poin penting agar lebih mudah diingat. Jika ada bagian yang sulit dipahami, saya akan mencari penjelasan tambahan dari internet, buku, atau bertanya kepada guru maupun teman. Saya juga sering mencoba mengerjakan soal latihan supaya lebih memahami cara penerapan materi tersebut.

Saya lebih suka memahami materi melalui kombinasi mendengarkan penjelasan orang lain dan belajar mandiri. Penjelasan dari guru atau teman membantu saya memahami inti materi, sedangkan belajar sendiri membuat saya lebih fokus untuk mengulang dan memahami bagian yang belum saya kuasai. | Suasana belajar yang paling saya sukai adalah tempat yang tenang dan nyaman karena membuat saya lebih mudah fokus memahami pelajaran. Biasanya saya belajar di kamar dengan meja belajar yang rapi, buku pelajaran, alat tulis, serta terkadang ditemani musik pelan agar tidak terlalu sepi. Saya lebih mudah berkonsentrasi ketika suasana di sekitar tidak terlalu ramai dan minim gangguan, seperti suara televisi atau percakapan yang terlalu keras. Menurut saya, suasana yang tenang lebih cocok karena membantu saya berpikir dengan lebih jelas dan memahami materi dengan lebih cepat. Walaupun sesekali belajar bersama teman terasa menyenangkan, saya tetap lebih bersemangat belajar dalam lingkungan yang nyaman dan tidak terlalu ramai. | Ketika menghadapi kesulitan atau tantangan dalam belajar, saya biasanya mencoba memahami materi tersebut sendiri terlebih dahulu dengan membaca ulang catatan atau mencari penjelasan tambahan dari buku maupun internet. Jika masih merasa bingung, saya akan mencoba mengerjakan contoh soal atau melihat penjelasan yang lebih sederhana agar lebih mudah dipahami. Namun, apabila tetap mengalami kesulitan, saya tidak ragu untuk bertanya kepada guru, teman, atau anggota keluarga yang bisa membantu menjelaskan. Saya lebih sering mencoba menyelesaikannya sendiri terlebih dahulu karena ingin melatih pemahaman dan kemampuan berpikir saya, tetapi saya juga sadar bahwa meminta bantuan orang lain penting ketika masalah terasa terlalu sulit untuk diselesaikan sendiri. | Dari pengalaman belajar selama ini, saya menyadari bahwa saya lebih mudah memahami pelajaran jika belajar dengan suasana yang tenang dan memiliki waktu yang teratur. Saya juga belajar bahwa setiap materi membutuhkan cara pemahaman yang berbeda, sehingga saya perlu lebih sabar dan konsisten dalam belajar. Ada beberapa hal yang ingin saya pertahankan, seperti kebiasaan belajar mandiri dan mencatat poin-poin penting karena cukup membantu saya memahami pelajaran. Namun, saya juga ingin mengubah kebiasaan menunda belajar agar bisa lebih disiplin dalam mengatur waktu. Saat berada di lingkungan belajar baru, saya berusaha untuk beradaptasi dengan baik, bersikap terbuka, dan tidak malu bertanya agar bisa lebih cepat memahami suasana serta materi yang dipelajari.",R,Introvert,,
40,"saya lebih suka belajar sendirian atau ber2 saja sama teman karena jika terlalu ramai itu bisa menyebabkan tidak fokus,tapi saya lebih suka belajar sendiri karna jika ada teman pasti tidak langsung belajar membahas yy lainnya dulu | mencatat materinya dan membuat kata kata yg mudah dihafalkan atau diingat | lingkungan tenang atau sepi lebih nyaman belajarnya karna agar fokus  | materi yg belum dipahami jika ada materi yg belum dipahami susah untuk mengerjakan atau mempelajarinya jadi harus mencari tau materi itu dari google atau YouTube  | semoga bisa lebih rajin belajar dan menaikkan nilainya lagi agar bisa mendapatkan hasil yang maksimal",K,Ekstrovert,,
41,kebiasaa belajar saya lebih suka di malam hari dan lebih suka jika mendengarkan musik juga | lebih suka memahami materi sendiri dan menghafalkannya sendiri | tergantung tetapi lebih banyak suka dengan suasana yang tenang dari pada ramai | lebih suka meminta bantuan orang lain jika memang masalah itu benar benar sulit | tidak ada,K,Ekstrovert,,
42,"Belajar di kamar, pada saat malah hari dengan suasana yang sunyi atau dengan suara musik yang lumayan kencang | Cara memahami materi baru yang aku lakukan adalah mendengarkan penjelasan dari guru setelah itu baru membaca materi baru lebih lanjut. Dan lebih memilih belajar secara mandiri juga  | Suasana sunyi, tenang dan hanya ada suara alunan musik, mengapa bisa cocok karena tidak terlalu ramai atau hectic dengan suara lain yang bisa mengganggu konsentrasi | Mencoba menyelesaikannya sendiri terlebih dahulu lalu jika masih kesulitan minta bantuan orang lain  | 1.Aku ngga suka di ganggu pada saat sedang konsentrasi mengerjakan tugas atau saat memahami materi 
2. Tidak ada yang ingin aku ubah, karena itu sudah cukup. Mungkin aku akan mencoba belajar di area yang ramai seperti di kelas karena biasanya gampang ke distract setiap ada yang ramai dikelas. 
3. Sikap di lingkungan belajar baru, lebih ke gampang salah fokus dan terkadang malah ngga fokus pas belajar 
",A,Introvert,,
43,"Saya menyukai suasana belajar yang sunyi karna membuat saya lebih fokus, dan jika saya belajar dengan kelompok saya malah lebih banyak mengobrol daripada belajar  | Saya biasanya membaca materi berkali kali, kemudian saya coba untuk memahaminya, saya juga mengerjakan latihan soal, dan yang paling akhir saya coba menjelaskan materi tersebut kepada orang lain, agar lebih memahami materi  | Sunyi dan tidak ramai, dan biasanya saya mencari bimbingan dari orang lain setelah itu sisanya saya belajar sendiri  | Kurang banyakk bahan belajar, dan saya terkadang butuh bimbingan untuk memahami suatu materi  | Akademik saya rendah saat SMP, dan saya mengubah cara belajar saya saat SMA, dan saya sangat bersyukur karna hasilnya baik",A,Ekstrovert,,
44,"di kelas dan di kamar, lebih mudah paham dan enjoy kalau suasananya tenang dan sepi + nyaman. aku lebih nyaman belajar sendiri tapi kadang butuh temen buat diskusi atau sekedar bahas soal. | biasanya belajar mandiri tapi kalo bener2 ga paham baru diskusi bareng temen lain yg lebih paham atau bahas soal aja, tapi lebih mudah paham kalo denger penjelasan orang lain. | tempat yang leluasa, bersih, dingin trus wangi. harus sepi dan tenang karna kalo berisik aku susah paham karna fokus nya jadi terbagi bagi, kalo rame jadinya amburadul pelajaran nya. | biasanya bantuan teman/orang yang lebih paham tapi kalo mereka ga ada yang bisa bantu juga aku nyari di internet aja, denger penjelasan video orang lain di internet juga ngebantu aku sih buat bantu aku jawab. | metode belajar, sama aku mau buat lebih fokus buat belajar ya walaupun susah nerapin nya tapi aku mau pelan-pelan supaya setiap hari sekolah trus belajar di kelasnya ga sia-sia.",R,Ekstrovert,,
45,"biasanya dirumah dan waktu malam,saya lebih nyaman belajar dengan orang lain | saya biasanya memahami lebih lanjut materi yang baru dan saya suka mendengarkan orang lain yang menjelaskan materi | suasana yang damai dan tentram,lebih semangat dilingkungan tenang | saya biasanya tanya ke teman  | saya dimana² bisa memahami lingkungan sekitar ",K,Ekstrovert,,
46,saya lebih senang  belajar di rumah sendiri daripada bersama orang lain | melalui belajar mandiri dan mencari tau menggunakan materi yang jelas dan contoh soal  | saya suka belajar dengan suasana sepi dan tidak ada orang yang mengganggu waktu belajar  | saya lebih suka di bantu dan di jelaskan terlebih dahulu untuk menyelesaikan nya | untuk mempertahan kan pembelajaran biasanya di lakukan dengan bantuan orang lain dan agar tidak bosan biasanya menyetel musik ,A,Introvert,,
47,"bersama orang lain, krn bisa berdiskusi bersama | materi melalui diskusi dan mendengarkan penjelasan orang lain | lingkungan ramai | meminta bantuan orang lain | saya bisa memahami lingkungan",R,Ekstrovert,,
48,"Aku biasanya belajar dirumah, dan waktu belajarku adalah di jam 7/8-10 malam, tetapi jika ada kebutuhan belajar mendesak sprti besok ada ulangan harian/ujian sekolah, maka saya akan belajar lebih lama dan saya lebih suka belajar sendirian karna fokus saya tidak akan teralihkan untuk mengobrol | menulis materi ulang dengan mindmaping dan saya lebih suka belajar secara mandiri | Saya suka berada dilingkungan yang tenang tapi tidak terlalu sepi, karna tidak membuat saya terganggu | Ketika saya mendapat kesulitan dlm belajar, saya akan mencoba terlebih dahulu tp kalau sudah tidak menemukan solusi maka saya akan bertanya kpd orang lain | Sbgai pelajar saya sangat mengerti bahwa saya bukanlah orang yang mudah memahami suatu materi, yang saya pertahankan selama ini adalah konsisten dalam belajar setidaknya 30mnt sehari dirumah untuk sekedar mengulang materi yang penting, sikap saya saat berada di lingkungan baru adalah tergantung lingkungannya, jika lingkungannya tenang maka saya akan sangatt nyaman",V,Ekstrovert,,
49,"biasanya saya belajar dirumah atau ditempat yang nyaman, saya lebih suka suasana belajar yang tenang dan tidak banyak orang. saya lebih nyaman belajar sendiri atau belajar bersama tapi tidak yang banyak orang karena saya lebih bisa fokus | mendengar penjelasan guru dulu sampai paham. saya lebih suka mendengarkan penjelasan orang lain  | suasana yang tenang dan sepi tidak terlalu banyak orang karena lebih mudah memahami pelajaran. saya lebih bersemangat jika dilingkungan yang agak rame karena saya bisa berbicara atau berdiskusi bersama orang lain  | susah memahami materi yang sangat sulit , biasanya saya mencoba untuk menyelesaikan sendiri jika tidak bisa saya akan melihat tutor dari internet  | mengubah waktu belajar menjadi lebih teratur, saya cukup nyaman jika belajar di tempat baru jika suasana nya sepi dan bisa membuat saya fokus",K,Ekstrovert,,
50,"belajar di sekolah atau biasanya kalau malam ya belajar di rumah, suasananya lebih suka yang hening agar tidak mengganggu konsentrasi.
belajar sendiri lebih bisa fokus | saya suka membaca materi di buku atau kalau di buku tidak lengkap biasanya cari di internet. akan lebih cepat paham untuk dibuat kesimpulan dan lebih suka belajar mandiri | lebih bersemangat dan fokus di lingkungan tenang  | biasanya bertanya kepada guru dan teman atau searching di internet | kunci belajar itu fokus tidak perlu memikirkan hal lain, saat berada di lingkungan belajar baru yaitu mengikuti saja dan jangan sampai tertinggal",K,Ekstrovert,,
51,"di kamar, habis magrib, biasaa aja sih ga rame && ga sepi juga. ak lbh hmm 50/50 sih, kadang pengen nya sendiri tapi kadang juga pgn sama temen gitu | tanya ke temen mungkin  | sepi sih && di suruh ngerjain soal dulu gt. sebenernya 50/50 cuma kalo rame lebih seneng aja sih, kalo tenang kadang serem | waduh, susah fokus sih kayaknya... aku tuh susah nginget2 materi gt lah, biasanya ak nulis ulang smpe mampus pokonya smpe inget dah, biasanya ak minta gpt sih (soalnya ga ada partner study date jiakhhh). ak kyknya lebih sering minta bantuan deh | ada sih, pengen nya lebih fokus gt kalo belajar terus maunya di lingkungan yg tenang gt kalo belajar ",K,Ekstrovert,,
52,saya lebih suka dengan berdiskusi dengan orang lain | saya lebih suka mendengarkan penjesalan orang lain | mendengarkan musik  | saya lebih suka menyelesai kan masalah sendiri | agar tidak bosen mengajak bicara orang lain,K,Ekstrovert,,
53,"biasanya aku belajar dirumah, karena butuh konsentrasi, dan saya suka belajar sendiri daripada banyak orang bisa menganggu konsentrasi ssya | Membaca secara menyeluruh lalu mempraktikkan dengan soal | Saya paling bisa fokus dilingkungan yang tenang sejuk | Menganalisis materi secara mandi terlebih dahulu sebelum meminta bantuan kepada orang lain | Saya menyadari bahwa proses belajar adalah perjalanan yang dinamis",K,Ekstrovert,,
54,"Dirumah,suasana cukup tenang,lebih nyaman sendiri  | Penjelasan org lain dan belajar mandiri | Saya suka belajar di tempat yang sepi dan tenang dengan cuaca yang tidak panas | Terkadang saya mencari di internet dan terkadang saya meminta diajari teman | Terkadang saya malas untuk belajar saya harus menghilangkan rasa malas tersebut",K,Introvert,,
55,"Belajar di rumah,saat malam hari, suasana tenang tidak berisik.lebih suka belajar individu ketimbang dengan orang lain  | Penjelasan orang lain dengan belajar mandiri | Saya suka belajar di tempat yang sepi dan tenang dengan cuaca yang tidak panas | Terkadang saya mencari di internet dan terkadang saya meminta diajari teman | Terkadang saya malas untuk belajar saya harus menghilangkan rasa malas tersebut",K,Introvert,,
56,"Belajar di rumah, saat malam hari, suasananya tenang tidak berisik. Lebih suka belajar individu ketimbang dengan orang lain | Penjelasan orang lain dengan belajar mandiri | Saya suka belajar di tempat yang sepi dan tenang dengan cuaca yang tidak panas | Terkadang saya mencari di internet dan Terkadang saya meminta diajari teman | Terkadang saya malas untuk belajar saya harus menghilangkan rasa malas tersebut",K,Introvert,,
57,"Saya yang pasti belajar di sekolah dan dirumah saat malam hari dengan suasana ruangan yang hening dan nyaman. Lebih suka belajar sendiri karena lebih bisa fokus secara maksimal | Mencatat materi penting di buku tulis dan mendengarkan penjelasan orang lain | Saya lebih suka di tempat yang tenang, saya akan bersemangat jika ada teman hanya maksimal 5 | Bertanya kepada teman dan meminta bantuan kepada teman/yang lebih mengerti | Ingin mengubah dari cara belajarku dan sikapku akan mengikuti pada lingkungan yang ada",R,Ekstrovert,,
