ID,Esai,Gaya Belajar,Tipe Kepribadian,,
92,"Otodidak memanfaatkan Media Sosial | dnegan sering meringkas dan membaca ulang catatan yg ditulis | aktif saling tanya jawba | terkadang susah me manage waktu, dan lebuh sering menyelesaikannya sendiri dan menjadikannya bahas evaluasi | ada, lebih memanfaatkan waktu untuk  membaca dan ber adaptasi dengan cara belajar baru",V,Ekstrovert,,
93,"bersama orang lain agar mendapatkan pikiran yang lebih luas | mendengarkan penjelasan orang lain | di lingkungan ramai | mencoba menyelesaikan sendiri agar dapat berusaha dulu | tidak, malu malu dan takut untuk berekspresi ",A,Ekstrovert,,
94,belajar mandiri membuat yang dipelajari masuk dan paham | Mendengarkan lewat vidio | Iya | sendiri  | senang,A,Introvert,,
95,belajar bersama orang lain krn seru dan menyenangkan | mendengarkan penjelasan oranglain karena tinggal dengerin | bersemangat jika di lingkungan yang tenang karena tidak banyak orang | menyelesaikan terlebih dahulu krn itu urusan ku | saya sebagai pelajar ingin meningkatkan belajar saya melalui literasi dan mendengarkan orang menjelaskan dll,A,Ekstrovert,,
96,belajar sendiri dirumah setelah isya dengan suasana tenang | Mendengarkan materi | Kondisi yang sunyi tidak terlalu banyak orang dan suara | Mencoba menyelesaikan terlebih dahulu sendiri | Ingin merubah sikap malas dan ingin mempertahankan sikap yang rajin,K,Ekstrovert,,
97,"Lebih nyaman belajar sendiri karena membuat lebih konsentrasi dan tidak ada gangguan dari orang lain | Saya lebih suka mendengarkan penjelasan orang lain dan belajar mandiri untuk mencari kebenaran dalam mempelajari materi baru | Lebih bersemangat di suasana yang tenang karena bisa memfokuskan kegiatan belajar tanpa ada gangguan orang lain | Mencoba menyelesaikan sendiri, jika tidak mampu maka saya akan meminta bantuan kepada orang lain | Saya akan mempertahankan cara belajar dengan memahami, mengingat dan menulis",K,Introvert,,
98,"lebih nyaman belajar kelompok karena bisa saling membantu | saya lebih suka materi mendengarkan karena bisa lebih fokus  | saat sunyi | tidakk | belajar kelompok dan mendengarkan yang saya sukai, saat di lingkungan baru saya harus beradaptasi terlebih dahulu ",K,Ekstrovert,,
99,"belajar saya adalah saat malam hari setelah makan malam, biasanya di dalam kamar tidur sendiri. Suasana malam yang sepi membuat saya jauh lebih mudah untuk berkonsentrasi tanpa banyak gangguan dari aktivitas orang lain di rumah. Di meja belajar saya saat ini, suasananya cukup minimalis, hanya ada laptop, buku catatan, dan lampu belajar yang cahayanya fokus ke meja. Jujur saja, saya tipe orang yang jauh lebih nyaman belajar sendirian daripada kerja kelompok. | saya lebih suka memahami materi mendengar kan penjelasan dari orang lain ,belajar mandiri  | suasana yang tenang | mencoba menyelesaikan nya sendiri terlebih dahulu  | tipe pelajar visual dan butuh ketenangan untuk berkembang ",R,Introvert,,
100,"tergantung,jika ada info belajar bareng saya langsung berangkat, jika tidak ada sayang belajar sendiri di rumah  | saya lebih suka memahami materi melalui diskusi karena lebih seru  | saya lebih bersemangat ketika di lingkungan ramai  | mencoba menyelesaikan sendiri terlebih dahulu agar bisa merasakan experience baru | mungkin untuk saat ini saya ingin mempertahankan nya dulu,dan jika di lingkungan baru saya akan menyesuaikan nya",K,Ekstrovert,,
101,"kebiasaan belajar saya yaitu saya lebih suka belajar sendiri dan di jam ketika semua orang masih tidur(jam 3-4)karna saya lebih mudah fokus | saya lebih suka memahami materi ketika di sampaikan dengan di cantumkan bukti nyata,saya lebih suka belajar sendiri | suasana ketika di putarkan vidio tentang pembelajaran | ketika saya kesulitan saya bertanya dengan teman sebangku  | saya merasa kurang konsisten",K,Ekstrovert,,
102,"saya belajar saat suasana sepi | dengan memahami konsep dasar materinya, dan saya lebih suka belajar sendiri  | yang membuat saya fokus yaitu suasana yag tidak terlalu ramai  | bertanya ke saudara aku teman sebaya | dengan membaca dan memahami sudah cukup",R,Ekstrovert,,
103,"saya biasa belajar di sekolah dan terkadang juga dirumah, saya biasa belajar sambil mendengarkan musik, suasana yang saya suka adalah tenang, saya lebih suka belajar sendiri karena dapat lebih fokus pada materi yang dipelajari | saya biasa membaca ulang materi nya dan memahaminya, saya lebih suka memahami materi dari mendengar kan penjelasan dari orang lain  | suasana belajar yang tenang karena jika suasana nya tenang materi yang dipelajari akan mudah dipahami dan bisa lebih fokus  | jika mengalami kesulitan belajar maka saya akan mencari tau terlebih dahulu tetapi jika saya tidak menemukan jawabnya maka saya akan berdiskusi dengan orang lain  | tidak ada yang ingin saya rubah karena menurut saya metode belajar saya sudah mampu membuat saya memahami materi yang saya ingin pelajari ",A,Ekstrovert,,
104,"saya belajar jika mood saya membaik dan belajar saya harus di lingkungan yang tenang, biasanya saya lebih suka belajar sendiri  | saya biasanya cara memahami materi dengan cara diterangkan terlebih dahulu selanjutnya saya ingin latihan soal, karena dengan latihan soal saya bisa tahu mana yang sudah saya ketahui dan mana yang belum saya ketahui | saya suka suasana yang sepi tenang, soalnya dengan ketenangan tersebut saya mudah berkonsentrasi untuk memahami materi  | saya biasanya menghadapi masalah tersebut dengan mengumpulkan mood agar semangat belajar  | saya suka gaya belajar saya yang sekarang ",A,Ekstrovert,,
105,"Saya terbiasa belajar dengan metode mandiri di saat malam hari agar bisa lebih fokus tanpa gangguan. Belajar sendiri lebih nyaman bagi saya karena memberi keleluasaan untuk mengatur waktu, dan fokus secara mandiri. | Mengenai metode penerimaan informasi, saya menyukai kombinasi antara belajar mandiri dan diskusi. | Saya bekerja paling optimal dalam suasana yang tenang  | Saat menghadapi tantangan belajar, saya selalu berusaha mencoba memecahkannya sendiri terlebih dahulu untuk melatih kemampuan analisis. Jika benar-benar tidak paham, saya mengidentifikasi masalahnya dan mencari solusi melalui artikel referensi, buku, atau video edukasi sebelum meminta bantuan instruktur atau teman diskusi. | Saya terus melatih diri untuk mengurangi ketergantungan pada AI dan saya akan terus mempertahankan pendekatan yang terstruktur, objektif, dan fakta.",K,Introvert,,
106,"Kebiasaan belajar sehari hari saya sangat menyenangkan, saya bisa belajar di mana saja tidak harus di satu tempat, suasana yang ada di sekitar saya sangat senang, saya lebih suka belajar bersama karena dapat bertukar ide atau pokok pikiran | Dengan cara di selingi game saat penjelasan dan tidak terlalu monoton, saya lebih suka memahami materi dengan cara mendengar kan penjelasan orang lain karena lebih gampang dimengerti | Sedikit tenang dan sedikit ramai karna suasana yang pas membantu cepat bisa memahami, kedua nya saya suka keramaian saat kumpul dengan teman, dan saya suka suasana tenang saat ingin beristirahat | Saat mengalami kesulitan dalam belajar saya biasanya akan bertanya pada teman saya atau melihat video penjelasan, mencoba menyelesaikan sendiri terlebih dahulu | Lebih bisa fokus terhadap suatu hal, lebih giat belajar, saya akan mencoba menyapa atau mempelajari komunikasi yang ada di lingkungan baru",K,Ekstrovert,,
107,"kalau dirumah biasa nya nunggu suasana sepi biasa nya malam hari dikamar dan belajar nya sendiri kalau bner bner kesulitan baru minta tolong orang lain jika bnr² ga bisa mempelajari materinya. 

kalau di sekolah ya biasa bareng teman teman mengejarkannya bagi bagi tugas.  | menulis ulang catetan dan di perinci menggunakan bolpen warna warni dan di baca baca ulang tapi kalau bnr² ga paham baru tanya orang lain yg lebih tau.  | tenang ga ada suara atau gangguan apapun, disekitar ga ada orang sama sekali, cocoknya karna biar materinya masuk ke otak dan hafal. kalau buat belajar sendiri buat hafalan buat memahami suasana nya yang tenang tapi kalau buat diskusi suasana yang ramai.  | bertanya orang lain yang lebih paham kalau dirumah tanya kakak kalau di sekolah tanya guru atau teman dekat, kalau lagi sendiri biasa nonton youtube atau pun browsing  | pengalaman belajar biasa aja sih tp ya seru seru karna banyak kerja kelompok bareng temen di tempat tempat luar jadi seru aja sih, 
yang ingin ak ubah lebih fokus lagi dan lebih cepat memahami suatu materi . 
di lingkungan baru mungkin beradaptasi dulu memahami suasana lingkungan nya gmn dulu baru nanti bisa beradaptasi ",R,Ekstrovert,,
108,"saya belajar lebih nyaman sendiri ditempat sepi dan tenang agar saya bisa fokus | saya sering sekali memahami materi dengan cara menulis kembali materi atau memehami konsep materi | suasana yang tenang aman nyaman seperti dialam dikamar ditempat yang tenang dan sepi | saya sering sekali mudah lupa tetapi saya berusaha mengingat"" sampai ingat jika saya benar"" lupa saya pasti tanya ketmn  | saya orang yang ceria membuat tmen saya tertawa saat belajar tidak cenderung tegang",R,Introvert,,
109,"biasanya dirumah, tetapi kalau diajak teman belajar di luar ya ngikut. biasanya belajar malam hari bakda Maghrib atau isya. lebih nyaman belajar berdua bersama teman di tempat yang tanang | biasanya ketika guru menjelaskan hanya fokus menangkap inti dari penjelasan lalu di ingat dikepala | biasanya say abelajar di tempat yang tenang sambil mendengarkan musik dimanapun kapanpun itu | kurang fokus apabila orang sekitar mengobrol saat kita lagi fokus (terdistraksi) | saya kurang fokus, aku ingin mengubah itu",K,Ekstrovert,,
110,"biasanya saya belajar dirumah tepatnya di kamar di meja belajar itu sekitar malam hari jam 7 biasanya suasana nya sunyi dan kadang bikin bosen kalau semisal tidak ada temen gitu saya sambil mendengarkan musik, kalau belum terlalu malem dan ada waktu luang gitu saya biasanya mengajak teman untuk keluar biar bisa belajar bersama. karena kalau belajar bersama teman itu rasanya nyaman karena ada tempat cerita juga jadi tidak membuat bosen. | saya biasanya membuat catetan baru di kertas/buku sesuai materi yang dipelajarin, biasanya saya membaca materi tersebut hingga benar"" paham dan saya lebih suka berdiskusi karena lebih mudah memahami materi jika dipikirkan bersama sama | biasanya saya di kamar sendirian dengan lampu yang lebih cerah itu bisa membuat semangat belajar meningkat dan saya lebih bersemangat apabila belajar dengan suasana yang tenang | saya kesulitan belajar itu apabila mendapatkan tugass yang jawabannya itu tidak ada di bacaan kadang merasa bingung karena belum pernah dipelajari tp mendapatkan tugas tersebut, solusi saya biasanya itu bertanya terlebih dahulu kpada teman dan saya mencoba mengerjakannya sendiri apabila tidak bisa nanti saya akan mencari bantuan tutorial di google atau di internet lainnya | saya itu kurangg fokus dan mudah bosen apabila suasana nya begitu"" saja, mungkin akan ditingkatkan lagii untuk itu dan saya ingin mempertahankan mencatat materi yang akan dipelajari, dan saya akan tingkatkan lagi mengenai waktu belajar saya dan akan saya tingkatkan lagi mungkin, untuk di lingkungan belajar baru saya mudah nyaman dengan tempat baru asal tempatnya itu sepi dan dapat membuat saya merasa lebih fokus",K,Ekstrovert,,
111,"menulis ulang poin yg penting. belajar dmn aja&kpn aja dgn suasana yg nyaman. lebih suka belajar bersama orang lain krn jika ada kesulitan bs didiskusikan | menulis poin yg penting, namun jika mengerjakan mtk/kim/fis lbh suka dicatat lengkap. 
lebih suka diskusi krn bs saling membantu | kondisi bljr yg aku sukai tmpt yg dingin,sunyi krn bs membuat lbh fokus.lbh bersemangat dgn suasana yg tenang | mencoba sendiri dulu, kalau tdk bisa baru bertanya ke orang lain sprti teman/guru | tdk ada yg ingin dirubah. sikapku dilingkungan belajar baru agak tdk nyaman dan tdk terlalu fokus, tergantung dengan guru pengajar dan teman",R,Introvert,,
112,"saya kebanyakan belajar ketika ada tugas, mendekati ujian atau jika ada ulangan harian, saya biasanya belajar dirumah atau terkadang juga ditempat les, saya lebih nyaman belajar sendiri karena menurut saya itu lebih masuk atau dapat dicerna dengan baik oleh saya, dan saya juga mudah menghafal atau paham jika belajar sendiri | cara saya menghafal biasanya dengan menghafalkannya berulang ulang kali atau bisa juga dengan cara mengerjakan latihan latihan soal, saya lebih suka memahami materi dengan belajar mandiri tetapi saya juga lumayan suka mendengarkan penjelasan dari orang lain | kondisi belajar yang paling saya suka adalah dengan keadaan tenang dan sunyi jika menghafal, tapi kalo hanya mengerjakan tugas biasa saya lebih suka dengan mendengarkan musik atau dengan menonton, saya lebih bersemangat jika berada dilingkungan yang tidak terlalu ramai taoi juga tidak terlalu sepi | jika saya kesulitan dalam belajar saya biasanya akan bertanya kepada guru saya, atau jika tidak biasanya saya akan mencari solusi melalui google atau aplikasi lainnya. saya lebih suka mencari cara untuk menyelesaikannya dulu terlebih dahulu jika memang masih engga bisa, sayaa baru akan mencari bantuan | dari cara saya belajar saya dapat mengetahui bahwa diri saya adalah pribadi yang sangat memplaning segala sesuatu yang penting",K,Introvert,,
113,"saat hari hari sekolah saya biasanya belajar pada malan hari setelah sholat isya, tapi saat weekend saya suka belajar diluar bersama teman teman saya | cara saya memahami materi adalah dengan mendengarkan penjelasan materi dari guru terlebih dahulu lalu mencoba mengerjakan contoh soal"" dan apabila kesulitan saya dapat bertanya kepada teman saya yang sudah paham | lingkungan belajar yang tenang dan nyaman dapat membuat saya lebih fokus belajar | saya akan bertanya kepada teman saya yang sudah paham materinya | saya suka belajar karena dengan belajar saya mendapatkan pengetahuan baru dan saat saya bisa memecahkan soal soal saya merasa ada kepuasan tersendiri terhadap diri saya, namun saya juga mudah lupaa tentang apa yang saya pelajari  terutama rumus rumus karena saya tidak menerapkanya dikehidupan saya sehari hari",K,Ekstrovert,,
114,"saya belajar dgn cara mencatat ulang lalu dihafalkan,biasanya mlm hari di kamar,suasananya biasa aja,lebih nyaman sndiri krn lbih fokus | melihat yt lalu dicatat dan mencoba mengerjakan soal,lebih suka belajar mandiri | saat malam yg sepi & dingin ada makanan ada minuman jg musik ,suasana yg tenang | dari yt lalu jika msh blm phm tanya teman,mncoba mnylesaikan sndri dahulu | ngga ada yg ingin dirubah dan hanya perlu menambah fokus",K,Introvert,,
115,"biasanya belajar di rumah, suasana yang saya suka sepi biar fokus.dan saya lebih nyaman belajar sendiri  | cara memahami materi dengan mencatat point point penting dan langsung menghafalkan,lebih suka memahami materi dengan melalui berdiskusi  | kondisi belajar yang saya sukai yang tenang dan tidak ramai  | kesulitan yang saya hadapi dalam belajar adalah melawan malas,dan solusinya dengan melihat materi melalui video | sebagai pelajar saya belajar kedisplinan,yang ingin saya pertahankan adalah belajar dengan mencata point penting ",K,Ekstrovert,,
116,"saya belajar hanya saat ada ujian saja karna menurut saya belajar 8jam di sekolah sudah sangat cukup , saya lebih nyaman belajar bersama orang lain karna jika saya sendiri tidak akan belajar  , tetapi akan main hp  | cara saya memahami materi adalah dg cara membaca lalu menuliskan ulang di buku  , saya menyukai semuanya kecuali belajar mandiri | kondisi belajar yang paling saya sukai adalah ruangan yang tidak berisik dan tidak gelap ruangan itu cocok untuk saya karna saya orangnya mudah hilang fokus jika di sekitar saya banyak gangguan seperti suara dll | ketika saya menghadapi kesulitan dalam mempelajari materi , saya akan menghubungi teman saya untuk menjelaskan ulang , jika teman saya juga gabisa biasanya saya akan mencari di youtube tentang materi tsb | sebenernya gaada yang perlu di pertahanin soalnya menurut saya cara belajar saya tidak baik. justru harus di rubah",K,Ekstrovert,,
117,"Kebiasaan belajar saya sehari-hari biasanya dilakukan pada malam hari, sekitar pukul 19.00 hingga 21.00, saat suasana rumah sudah mulai tenang. Saya lebih suka belajar di meja belajar kamar sendiri karena kondisinya yang hening dan minim gangguan. Mengenai kenyamanan, saya jauh lebih nyaman belajar sendiri. Alasannya, saya bisa mengatur kecepatan belajar saya sendiri tanpa merasa terburu-buru atau terhambat oleh orang lain, serta lebih mudah untuk tetap fokus pada materi yang sedang didalami. | kalau materi perhitungan, pertama saya mencatat rumus' sama memahami saat menulis, jika udah saya mencermati rumus itu. setelah dicermati saya mencari' contoh soal yang sama dengan materi itu. kalau materi teori saya lebih suka membaca dulu stelah itu memahami dgn melihat video di yt atau mendengarkan guru saat menjlaskan | kondisi belajar yang paling membuat fokus yaitu saat suasananya tenang, kalau saat belajar sendiri saya lebih suka belajar dengan mendengarkan musik. kalau di lingkungan ramai itu bisa lebih semangat karena seru, tapi kalau tenang lebih membuat saya lebih fokus | Ketika menghadapi tantangan atau kesulitan dalam belajar, hal pertama yang saya lakukan adalah mencoba menyelesaikannya sendiri terlebih dahulu. saya biasanya akan membaca ulang materi terkait atau mencari referensi tambahan melalui internet dan video edukasi untuk mendapatkan pemahaman yang lebih luas.Jika setelah mencoba mandiri saya masih menemui jalan buntu, saya akan meminta bantuan orang lain seperti teman diskusi atau bertanya langsung kepada guru. | selama ini yang membuatku lebih mengejar nilai saat lingkungan kelasnya pada rajin"". jadi saya dapat termotivasi kalau teman"" rajin saya juga harus lebih rajin lagi daripada sebelumnya",K,Ekstrovert,,
118,"saya biasanya belajar bisa dimana saja namun harus ditempat yang tenang dan sendiri, saya biasanya belajar dengan memahami soalnya terlebih dahulu lalu membaca dan sedikit menghafal. jika tentang hitungan saya lebih ke menonton vidio penjelasan dan contoh soal lalu mengerjakan sebanyak banyaknya.  | saya melakukan pendekatan secara berlapis tentang belajar mandiri. saya lebih suka memahami melalui pendengaran dari orang lain dan saya akau mendengarkan lebih dari 2orng lalu membandingkan jawaban mereka, untuk jawaban akhir saya lebih suka membandingkan dengan diri sendiri.  | kondisi saat malam hari yang sunyi saya suka karena itu membuat pikiran lebih tenang dan lebih nyaman untuk beradu argumen dengan pikiran saya sendiri. saya biasanya cenderung suka lingkungan yang tenang.  | biasanya saya akan mengumpulkan niat terlebih dahulu dan saya akan menjauh dari hp. materi yg tidk saya pahami saya akn meminta penjelasan dari orang lain lalu meminta contoh soal lalu saya mengerjakan dan saya minta untuk minta pembetulan dari orang tersebut.  | saya mempelajari bahwa selama pikiran kita terjaga maka kita akan mudah mengendalikannya dan saya akan selalu berusaha untuk menjaga pikiran saya tetap tenang dan rileks. saya akn mempertahankannya. sikap saya slama ini pada lingkungan belajar baru bisa saya sesuaikan tergantung dengan diri saya sendiri. ",V,Introvert,,
119,"saya biasanya belajar disekolah bersama dengan teman teman saya, karena saya merasa akan lebih mudah memahami materi jika mengerjakannya bersama teman teman saya..namun ketika sedang ujian saya lebih suka belajad sendiri ditempat yang tenang dan hanya ada saya, saya merasa jika di tempat yang tenang akan lebih fokus dan materi yang saya pelajari bisa saya pahami dan saya ingat. | saya suka memahami materi jika berdiskusi atau bertanya dengan teman teman saya, karena terkadang beberapa guru menjelaskan materi namun saya kurang paham sehingga saya berdiskusi dengan teman saya jika teman saya kurang paham, kami akan belajar memahami materi ssndiri lewat media sosial atau youtube, saya lebih suka jika materinya dijelaskan lalu kami mencatat matereri yang sudah dijelaskan..karena benerala guru hanya menjelaskan saja tanpa mencatatkan atau mengirim ppt materi tersebut | saat saya belajar, saya lebih suka suasane yang tenang dan sepi..karena itu dapat membantu saya memahami materi dan fokus untuk belajar sehingga materi yang saya pelajari bisa masuk ke otak saya..saya bisa memposisikan diri saya, saat sedang bersama teman teman saya disuasana yang ramai saya bisa bersemangat, namun saat di suasana yang tenang saya juga bisa menyesuaikan tempat tersebut | saya merasa saya sulit memahami beberapa materi yang duberikan guru saya, menurut saya tantantannya saya harus belajar sendiru untuk benar benar memahami materi tersebut..biasanya saya mencari materi tersebut dari internet dan bertanya kepasa teman teman saya.. | saya ingin terus belajar untuk mengetahui materi yang ada walaupun saya kurang semangat untuk memelajarinya, namun saya akan mencoba untuk konsisten belajar",R,Ekstrovert,,
120,"aku biasanya belajar di sekolah, dimulai dari jam 7 pagi dan selesai belajar jam setengah 4 sore. Suasana di sekitar ku biasanya ramai dan asik, jadi aku lebih suka belajar bersama orang lain daripada belajar sendiri | aku biasanya kalau ingin memahami materi itu langkah awal pasti aku bertanya kepada yang bersangkutan, atau ngga aku lihat materi di google atau lihat video penjelasan di YouTube  | aku lebih suka suasana yang tenang saat belajar, karena suasana tenang ga bikin aku kepikiran hal lain saat belajar. belajar sambil dengerin lagu, top tier ⭐️⭐️⭐️ | aku ketika menghadapi tantangan belajar pasti aku coba dulu sendiri, kalau bingung banget baru aku tanya ke guru atau pembimbing di kelas | mungkin aku mau merubah diriku yang lemot ini kalau lagi pelajaran, soalnya kadang kaya orang bingung #jujur",V,Ekstrovert,,
121,"kebiasaan saya saat belajar bersama teman’ dekat, biasanya saya belajar di sklh atau di rumah teman sehabis pulang sekolah taua saat hari libur, suasana belajar disekitarku sangat seru dan saling membantu satu sama lain, saya suka belajar bersama’ karena belajar bersama sama bisa saling tanya-tanya materi yang dibingungkannya | saya paling suka belajar materi melalui diskusi karena dengan diskusi kita dapat mendengar penjelasan/pendapat orang lain yang kita tidak ketahui  | suasana yang tenang tapi menghibur karena dengan begitu saya belajarnya tidak mudah jenuh dan saya lebih semangat saat berada di lingkungan yang ramai tapi tenang | saya akan bertanya kepada teman saya yang sudah paham dengan materi tsb dan menanyakan caranya agar bisa keluar dari masalah tsb  | ingin mengubah diri saya yang dulu sampai saat ini masih lebih bergantung pada orang lain dan kedepannya ingin menyelesaikannya dendiri dulu baru meminta pendapat orang lain",A,Ekstrovert,,
122,"Dengan cara membaca, berlatih melalui latihan soal dan mengerjakannya dgn membuka catatan serta membandingkan jawaban dr internet. suasana yang ada d sekitar saya biasa sih ga gimana² ada kalanya ramai ada kalanya tenang. tergantung dengan siapa partner belajar saya, jika orang nya bisa membuat saya merasa terdorong untuk belajar dan tidak malas² an saya suka, tp jika tidak bs serius hanya bisa bercanda dan mengandalkan orang lain saya kurang suka. | melalui les biasanya, kalau ga ya pahami sendiri atau tanya ke guru mapel. jujur kl memahami materi saya lebih suka mendengarkan penjelasan orang lain dengan keadaan lingkungan sekitar yg tenang. | Lingkungan sekitar yang tenang, karena dgn itu kita bisa lebih fokus mendengarkan penjelasan dan dapat mencerna penjelasan tanpa terganggu dari sekitar orang. saya lebih bersemangat di lingkungan yang suasananya tenang. karna jika lingkungan nya ramai saya susah untuk konsentrasi. | karna saya mengikuti bimbel di salah satu bimbel, saya menggunakan fasilitas yang namanya TST, dibantu dgn guru mapel dr bimbel tersebut dengan penjelasan yang lengkap, rinci, dan mudah dipahami. tergantung bagaimana soal dan materi, jika merasa sulit saya langsung mengajukan jadwal TST, jika merasa mudah dan saya paham dgn materinya saya mengerjakan sendiri. | Saya adalah orang yang mudah ter distrake,, saya lumayan sulit memahami jika penjelasan yang di beri susah di pahami dan tidak jelas. kadang saya merasa rajin tapi 15 menit kemudian saya merasa malas. saya ingin sekali mempertahankan ke rajinan saya untuk belajar, dan semangat untuk belajar. saat di lingkungan belajar yang baru saya berusaha untuk beradaptasi",K,Ekstrovert,,
123,"kegiatan pembelajaran sehari hari cukup seru,saya lebih suka belajar bersama karena bisa bertanya dan berargumen bersama teman  | cara memahami materi dengan cara latihan soal,saya lebih suka memahami materi dengan belajar mandiri  | kondisi belajar yang paling baik ketika keadaan tenang karena tidak ada gangguan ketika guru menjelaskan, lingkungan ramai atau suasana tenang saya suka 2 2 nya tergantung suasana  | saya biasanya bertanya kepada teman jika teman tidak paham baru bertanya guru,saya lebih sering mencoba menyelesaikan sendiri jika tidak bisa baru bertanya  | refleksi pembelajaran ini lebih mengenal diri sendiri,tidak ada yang ingin diubah",K,Ekstrovert,,
124,belajar bareng teman karena bisa kerja sama | memahami materi melalu diskusi | lebih bersemangat yang agak ramai  | mencoba menyelesaikan sendirii terlebih dahulu baru minta bantuan orang lain | udah cukup,K,Ekstrovert,,
