ID,Esai,Gaya Belajar,Tipe Kepribadian,,
58,"aku biasanya belajar tu malem-malem, kalo waktunya ga tentu tapi seringnya jam 8an atau jam 9an, karna aku lebih sunyi gitu belajarnya sambil dengerin lagu, maksudnya tu berisiknya cuma lagunya gitu atau stream freetalk vtuber, dan yang pasti sendiri karna gasuka aja ramean gitu, malah jadi kurang efektif kalo menurutku  | tergantung situasi deh, kalo pas ujian sekolah aku suka nulis materinya ulang sesuai kisi-kisi sama biasanya ku tambahin materi yang menurutku susah dimengerti, kalo uh aku biasanya ngasi garis materi-materi yang sekiranya penting, kalo ada tugas kelompok biasanya enakan diskusi karna takutnya ga masuk sama materi lainnya | kondisi belajar yang paling ku suka tu ketika aku sendiri sambil dengerin lagu atau nonton stream vtuber, karna apa ya jadi lebih fokus malah kalo gitu gatau kenapa gapernah kedistract lagu/streamnya (jujur jadi tenang, ga gitu rame ga gitu sepi), 
kalau ditempat yang rame dan orang-orangnya udah kenal malah jadi semangat, tapi kalo lingkungan baru + ramai malah jadi takut kadang-kadang  | cara aku cari solusi yang sering banget itu aku tanya ke temen atau ke mantan kandungku XD karna jyujyur takut salah percaya omongan orang, tapi sebelumnya aku coba ku selesaiin sendiri dulu | yang pasti pengalamannya jadi banyak banget, kemarin bikin baju yang sebelumnya gapernah, berani solo vocal didepan banyak orang, tampil pd tanpa takut omongan orang dan masih banyak lagi, yang pengen ku rubah itu caraku berpikir kalo semuanya itu bisa instan pake ai padahal blom dicoba sendiri, dan yang ingin ku pertahankan itu adalah caraku menghitung kalo udah ngerti suatu materi, pasti sekalinya paham langsung ngerjain 20 soal pun ku jabanin",K,Ekstrovert,,
59,"dengerin musik sambil belajar dikamar sendiri jadi tenang nyaman damai tentram | jelasinnya secara tatap muka tapi cuman 2  orang doang klo banyak² susah paham nyaaa, suka yg mendengarkan penjelasan sama belajar mandiri tpi yg ga terlalu ramai  | belajar sambil dengerin musik, klo yg bareng² sebisa mungkin dilingkungan/tempat yg sepi  | sering meminta bantuan orang lain kadang nyelesaiin sendiri klo emg blm paham tanyaa | Dari pengalaman belajar selama ini, aku jadi tahu kalau aku lebih mudah paham kalau belajarnya santai tapi tetap fokus. Yang mau aku ubah mungkin kebiasaan suka nunda tugas, biar bisa lebih disiplin. Tapi yang mau aku pertahankan itu rasa semangat buat belajar hal baru. Kalau ada di lingkungan belajar baru, biasanya aku coba menyesuaikan diri, tetap sopan, dan pelan-pelan mulai berani buat bergaul sama orang lain.",K,Ekstrovert,,
60,"kebiasaan belajar saya sehari-hari biasanya belajar sambil mendengarkan musik. di sekolah dan di rumah, tenang. saya lebih suka belajar sendiri karena lebih mudah untung mengingat materi dan lebih fokus | dengan mendengarkan penjelasan tersebut berulang kali. saya lebih suka memahami materi dengan menggunakan metode mendengarkan penjelasan orang lain. | kondisi belajar yang membuat saya fokus adalah sengan suasana yang sepi dan tenang. saya merasa lebih bersemangat jika berada di lingkungan yang tenang. | dengan mencari"" solusi di artikel dan meminta bantuan teman. saya lebih sering meminta bantuan pada teman | semoga belajar dengan lebih rajin",A,Introvert,,
61,"saya bisa belajar di manapun tempatnya dan saya bisa belajar kapan saja | saya biasanya belajar dengan cara mencatat materi agar materi yang saya pelajari bisa cepat saya pahami  | suasana yang sepi tidak ada gangguan keramaian yang berlebih  | terjadinya keramaian yang membuat fokus pada diri saya berkurang,sehingga keramaian menjadi tantangan belajar saya | saya ingin merubah pola belajar saya,karena dulu hingga sekarang saya hanya belajar ketika hendak menjalani ujian saja,saya ingin merubah pola belajar saya,supaya belajar menjadi lebih ringan dan mudah paham",K,Ekstrovert,,
62,"saya biasa belajar di kamar posisi saat malam hari dengan suasana tenang dan sejukk | saa akan menanyakan materi ituu jika belum paham dan saya akan bertanya hingga paham, memahami materi dengan cara diskusi sangat lebih menyenangkan tapii kadang harus belajar mandiri | saya sendiri lebihh suka belajar dengan kondisi berdua bersama teman yang memiliki frekuensi yang sama saya suka suasana ini karna lebih tenang dan menyenangkan,saya lebih suka suasana tenang | pertama saya akan mencoba menyelesaikan sendiri dengan cara mencari di internet atau cara menyelesaikan jika belum bisa biasa saya bertanya kepada kakak sayaa | pelajaran yang saya dapat kan adalah jangan pernah meninggalkan waktu belajar,tidak ada,saya akan mencoba untuk adaptasi terhadap lingkungan sekitar ",K,Ekstrovert,,
63,"Kebiasaan belajarku sehari-hari biasanya berpusat di dalam kamar tidur pada malam hari, tepatnya setelah makan malam sekitar jam tujuh. Suasana di sekitarku saat ini sangat tenang dan minim gangguan, hanya terdengar suara kipas angin dan kendaraan sayup-sayup dari luar rumah. Kondisi yang sunyi ini sengaja aku ciptakan agar pikiranku bisa lebih rileks setelah seharian beraktivitas di sekolah. Dalam prosesnya, aku merasa jauh lebih nyaman belajar sendiri dibandingkan belajar bersama orang lain. Alasannya karena belajar sendiri memberiku kebebasan penuh untuk mengatur waktu dan menentukan materi mana yang ingin aku dalami terlebih dahulu tanpa harus mengikuti ritme orang lain.

 | Untuk memahami materi pelajaran yang baru, langkah pertama yang biasa aku lakukan adalah membaca keseluruhan teks secara sekilas untuk menangkap gambaran umumnya. Setelah itu, pendekatanku dilanjutkan dengan membaca ulang secara perlahan sambil menandai kalimat-kalimat kunci dan menuliskannya kembali ke dalam buku catatan menggunakan bahasaku sendiri. Aku jauh lebih suka memahami materi melalui belajar mandiri daripada berdiskusi atau mendengarkan penjelasan orang lain. Dengan belajar mandiri, aku memiliki ruang dan waktu yang cukup untuk merenungkan materi tersebut secara mendalam hingga aku benar-benar merasa paham dan menguasai konsepnya.

 | Kondisi belajar yang paling aku sukai dan paling membuatku fokus adalah ruangan yang rapi, sejuk, dan benar-benar senyap. Di sekitar tempat belajarku biasanya harus tersedia meja yang bersih dari barang-barang tidak penting, lampu penerangan yang cukup, serta segelas air putih untuk menjaga konsentrasi. Suasana seperti ini sangat cocok untukku karena fokusku mudah terpecah jika melihat lingkungan yang berantakan atau bising. Oleh karena itu, aku jauh lebih bersemangat saat berada di suasana yang tenang dan damai ketimbang di lingkungan yang ramai.

 | Ketika menghadapi kesulitan atau tantangan yang rumit dalam belajar, hal yang aku lakukan adalah mencoba menyelesaikannya secara mandiri terlebih dahulu. Aku mencari solusi dengan cara membuka kembali catatan lama, membaca buku referensi lain, atau mencari video tutorial yang relevan di internet. Jika cara-cara tersebut sudah aku coba namun tetap menemui jalan buntu, barulah aku meminta bantuan orang lain. Biasanya, teman sekelas yang lebih paham atau guru menjadi orang pertama yang aku hubungi untuk bertanya dan berdiskusi demi mendapatkan jawaban yang jelas.

 | Dari seluruh pengalaman belajar selama ini, aku belajar bahwa diriku adalah tipe pelajar mandiri yang sangat membutuhkan ketenangan untuk mencapai hasil optimal. Hal yang ingin aku pertahankan adalah kemandirian dan rasa penasaran yang tinggi dalam mencari solusi. Sementara itu, hal yang ingin aku ubah adalah kecenderunganku yang terlalu lama memendam kesulitan sebelum akhirnya mau bertanya. Saat berada di lingkungan belajar yang baru, aku akan bersikap terbuka, ramah, dan mencoba cepat beradaptasi dengan dinamika yang ada tanpa kehilangan cara belajarku yang mandiri.

",R,Introvert,,
64,"di malam hari, tenang, saya lebih nyaman belajar sendiri | lebih sukaa di jelaskan | tenang dan hening | menenangkan diri dan mencoba menganalisis bagian mana yang belum saya pahami.  | saya adalah tipe pelajar yang mandiri namun membutuhkan struktur yang jelas. Saya belajar bahwa saya lebih efektif ketika materi disampaikan secara visual atau melalui praktik langsung.

",K,Introvert,,
65,"Kebiasaan belajar saya biasanya dilakukan pada malam hari di kamar tidur karena suasananya lebih tenang dan kondusif. Saat ini, lingkungan di sekitar saya cukup sepi sehingga mendukung konsentrasi. Saya lebih nyaman belajar sendiri karena bisa mengatur ritme belajar sendiri tanpa mudah terdistraksi oleh orang lain. | Untuk memahami materi baru, langkah pertama saya adalah membaca garis besarnya, lalu mencatat poin penting atau mencoba latihan soal. Saya lebih suka belajar mandiri terlebih dahulu agar bisa fokus memahami konsep dasar. Namun, saya juga senang mendengarkan penjelasan orang lain jika menemui materi yang sulit. | Kondisi belajar yang paling saya sukai adalah suasana yang tenang dan rapi, seperti di kamar tidur dengan penerangan yang cukup. Di sekitar saya biasanya hanya ada buku catatan, laptop, dan segelas air putih. Suasana ini cocok karena membuat pikiran saya lebih rileks dan fokus. Saya merasa jauh lebih bersemangat dan produktif di lingkungan yang tenang dibandingkan tempat yang ramai. | Ketika menghadapi kesulitan belajar, saya selalu mencoba menyelesaikannya sendiri terlebih dahulu dengan membaca ulang materi atau mencari referensi tambahan di internet. Jika masih belum paham, saya baru akan meminta bantuan orang lain seperti teman atau guru. Internet dan video penjelasan daring biasanya menjadi hal utama yang sangat membantu saya menemukan solusi. | Saya belajar bahwa saya adalah pelajar mandiri yang butuh ketenangan. Saya ingin mempertahankan kemandirian ini, tetapi ingin mengubah kebiasaan menunda belajar. Di lingkungan baru, saya akan bersikap terbuka, mengamati situasi, dan perlahan beradaptasi serta membaur dengan teman-teman.",R,Ekstrovert,,
66,"belajar dirumah, sepi dan tenang, lebih suka belajar sendiri | mendengarkan penjelasan orang lain | suasana yang tenang | menanyakan hal kepada teman | lebih rajin ",A,Ekstrovert,,
67,"Saya sering belajar dirumah, dan hampir tiap malam belajar dan suasana yang tenang saat malam, lebih nyaman belajar bareng karena dapat memecahkan soal bersama | Saya dapat memahami materi dengan diadakan praktik secara langsung dan lebih suka dijelaskan materi secara langsung karena lebih mudah dipahami | Saya lebih suka suasana belajar yg sepi tenang dan damai agar fokus, dan saya akan merasa semangat saat berada dilingkungan yang tenang | saya akan mencari solusi di YouTube stay website lain agar lebih mendalami materi yg dipelajari, lebih sering menyelesaikan sendiri dibandung meminta bantuan | Saya merasa diri Saya terkadang masi malas dalam belajar dan saya ingin mengubah kebiasaan ini agar tidak menyesal dikedepan Hari nya, sikap Saya agak canggung dan merasa belum akrab tp lama kelamaan akan terbiasa",K,Ekstrovert,,
68,"saya belajar kalo mood saja. saya bisa belajar dgn fokus dikamar, dan jaran belajar jg si kl biasa paling banyak belajar saat ujian aja. saya suka mendengarkan lagu saat belajar (mencatat). saya lebih nyaman belajar sendiri agar fokus dan ga banyak omong. | menulis cara agar dapat memahami dgn baik dan cermat. kaya kl guru ngomong ""jadi caranya gini ..."" tp ga ditulis dipapam tulis, nah omongan kaya gt yg bikin paham. kl bisa ditulis dibuku biar kl lupa caranya yg ga ditulis dippn tulis, tp kita ms ada catetannya dibuku. | saya cocok belajar diatas kasur + mendengarkan lagu jj. karna kalo capek nulis langsung scroll tt bentar  | saya langsunh chat teman saya meminta bantuan untuk menjelaskannya ulang. | saya ingin belajar tiap hari, tp game sm tiktok lebih menarik jd saya akan scroll tt dulu baru belajar. tp saya akan belajar dulu deh habis ini",K,Introvert,,
69,Saya lebih suka belajar dengan orang lain dan langsung memperagakan nya atau mencontohkan  | Iya lebih suka memahami materi melalui diskusi atau mendengarkan penjelasan orang lain.  | Dua dua nya suka  | Saya akan mencoba menyelesaikan nya sendiri dulu  | Mencoba beradaptasi dengan cepat dan menyesuaikan ,K,Ekstrovert,,
70,"di kamar/r tamu, suasana yang tenang dgn mendengar kan musik dan lebih nyaman belajar sendiri | saya lebih suka mendengarkan penjelasan dari orang lain dan mencoba belajar sendiri dengan bantuin orang lain agar faham oleh materi | lebih bersemangat di lingkungan yang hening santai dan tidak ada yang mengganggu karna dapat membuat sya lebih fokus dalam belajar | saya lebih mencoba menyelesaikan sendiri jika saya benar' tidak yakin atau tidak bisa akan saya tanyakan kepada orang-lain | saya ingin mengubah fokus sya yang biasanya masih fokus di HP, dan saya akan mempertahankan cara belajar saya yang tenang dan santai dengan musik dan minuman",K,Ekstrovert,,
71,"aaya belajar dirumah dengan keadaan hening dan tenang,serta saya lebih nyamanbelajar sendiri karena lebih gampang konsentrasinya dibandingkan belajar bersama’ | dengan cara mengulang materi tersebut,saya suka dua’ nya tergantung pada materi yg diberikan | suasana yg hening karena dapat meningkatkan konsentrasi | saya lebih cenderung menyelesaikannya sendiri  | saya ingin lebih rajin lagi dalam belajar",R,Introvert,,
72,"biasanya saya belajar di malam hari,dengan suasan yang tenang dan mendengarkan musik sendirian,karena lebih nyaman dan tenang untung mengerjakan tugas  | Dengan di jelaskan di papan tulis oleh guru dan dijelaskan dengan teliti dan rinci | mendengarkan musik dengan suasana yang tenang dan sejuk | Dengan cara mengumpulkan niat dengan dibantu google dan menyelesaikan sendiri | Tidak,aku suka dengan cara belajarku sendiri dan menyesuaikan mood belajar dan menyesuaikan tempat",V,Ekstrovert,,
73,lebih nyaman belajar bersama teman  | lebih paham materi melalui diskusi dan mendengarkan penjelasan orang lain | saya lebih suka menyukai suasana yang tenang | saya lebih baik mencoba menyelesaikan masalah sendiri | senang,K,Ekstrovert,,
74,"belajar ketika akan ujian dan ketika ada tugas,terkadang ditempat yang sepi kadang jugaa juga mengerjakan dicafe sambil mengobrol bersama teman teman.tergantung suasana hati,kalau sedang mood belajar bersama orang lain,tapi jika tidak belajar se diri | dijelaskan dan diberikan contoh soal tentang materi tersebu.suka semuaa. | ketika belajar bersama teman teman saat nongkrong terkadang tidak fokus tapi seru.karena bikin hati senang.terkadang lebih suka lingkungan yang ramai,tpi kalau ada masalah lebih milih suasana yang tenang | yang membantu adalah pacar saya,karna dengan bercerita kepada pacar saya,saya akan mendapatkan penyelesaian atas masalah yang saya hadapii. | lebih rajin belajar",A,Ekstrovert,,
75,"lebih nyaman belajar secara berkelompok tapi suka juga secara individu  | Cara saya untuk memahami materi baru adalah dengan mengulangi materi itu beberapa kali, saya suka mendengarkan penjelasan orang yang  | Saya lebih suka kalo belajar sendiri dan  sambil mengapal materi dengan cara menutup mata dan menutup telinga*klo misalnya lagi ditempat ramai  | Kalo menghadapi kesulitan mungkin saya akan memperbaiki mood dulu, tidak  | kalo ada dilingkungan baru yang pasti beradaptasi terlebih dahulu dilingkungan baru",K,Ekstrovert,,
76,"saya suka belajar dengan cara egois. seperti di 2/3 malam jika semua orang sudah tertidur. akan cepat lebih paham dn hafal | mendengarkan penjelasan orang lain serta mencatat poin"" penting yang akan di pelajari | suasana yang tenang. kalau saya, jika masih ada orng yang berbicara. tidak akan bisa fokus dan pahm. jadi, harus benar benar tenang dan sunyi | saya akan mencoba untuk menyelesaikan nya dengan sendiri. ketika sudh menemukan solusi tetapi ragu, baru meminta pendapat oranglain. | memposisikan sikap, bagaimana harus bersikap di depan orang lain. ",K,Ekstrovert,,
77,"nyaman belajar bersama orang lain, karena bisa mendapatkan informasi yg sebelumnya belum di dapatkan, jadi menambah wawasan baru | mendengarkan penjelasan orang lain, karena lebih efisien  | bisa dua dua nya, tapi lebih tenang di suasana yg sedikit sepi | lebih sering membantu orang lain, karena dengan membantu kita menjadikan hati kita senang | menyadari bahwa saya belajar dengan lebih efektif ketika menggunakan teknik aktif seperti menjelaskan materi kembali kepada orang lain, bukan sekadar membaca ulang.",K,Ekstrovert,,
78,"saya biasanya belajar di rumah saat malam hari, soalnya sepi ngga brisik | saya biasanya mendengarkan penjelasan orang lain lalu saya bisa sedikit sedikit lumayan paham | saya suka kondisi belajar yang sepi dan tenang | tambah fokus dan lebih mendalami dan meminta tolong kepada orang lain untuk membantu saya | saya suka tergesa gesa, saya ingin merubah saya yang tidak suka tergesa gesa",K,Ekstrovert,,
79,"saya belajar biasa di rumah teman atau di tempat lain yang suasananya menyenangkan dan menggugah mood belajar saya. | saya lebih suka mendengarkan penjelasan orang lain dan mencari materi | yang bersemangat dan seru | saya lebih sering meminta bantuan kepada orang lain jika saya kesusahan dalam belajar | tidak ada yang ingin diubah, sikap saat di lingkungan baru saya lebih ke introvert",K,Ekstrovert,,
80,"saya biasanya belajar di rumah sendirian, suasana yg biasanya ada di sekitar saya saat ini yaitu terasa ramai. saya lebih suka belajar bersama' daripada sendirian karena kalau belajar sendirian bikin ngantuk | langkah-langkah yg biasa saya lakukan agar saya benar-benar memahami materi yaitu dengan dengan cara mendengarkan penjelasan orang lain | kondisi belajar yg paling saya sukai yaitu di tempat yg tidak begitu ramai karena membuat saya fokus untuk belajar, saya merasa lebih semangat saat ada di lingkungan suasana yg tenang | yg saya lakukan ketika menghadapi kesulitan saat belajar yaitu mencari solusi ke internet, terkadang saya mencoba untuk menyelesaikan sendiri terlebih dahulu tapi kalau saya nggak bisa baru searching ke internet | saya ingin mengubah diri saya supaya dapat belajar lebih giat lagi, dan sikap saya saat berada di lingkungan belajar baru yaitu beradaptasi agar dapat menyesuaikan",R,Introvert,,
81,"saya biasanya belajar sendiri diruma, saya suka belajar sambil dengerin musik tapi saya lebih nyaman jika belajar bersama teman  | saya akan paham materi jika ada vidio penjelasan atau grafik” nya | lebih fokus jika suasana lingkungan tenang | bertanya kepada guru atau kepada teman yang sudah paham materi tersebut  | ingin menjadi orang yang lebih semangat lagi dalam belajar. ",K,Ekstrovert,,
82,"saya biasanya belajar sendiri d jam 7 sampe 8 malem, sambil dengerin musik terus suasana di kamar harus sunyi walaupun saya dengerin musik. iya saya lebih suka belajar sendiri di banding bersama orang lain | saya biasanya klo memahami pelajaran baru saya harus les privat dulu baru paham dan yaa dikit² baca catatan dari guru. saya lebih suka mendengarkan penjelasan dari orang lain&belajar sendiri  | saya lebih suka belajar dgn keadaan tenang, udara dingin dan sambil dengerin musik. kalo semangat si suka nya d lingkungan ramai yhh | tantangan nya sii sama males yaa, kesulitan belajar si kalo keadaan itu ramai bgt berisikk. solusinya ke tempat yg sepi yg minim orang buat belajar, lebih sering meminta bantuan orang lain si | yaa pelajaran nya si saya suka belajar di keadaan sepi. engga ada yg mau saya ubah dari cara belajarnya ku si",K,Ekstrovert,,
83,belajar membaca buku. belajar sendiri. | memahami contoh. memahami sendiri. | belajar  sendiri. suasana tenang. | mencari contoh. mencoba sendiri. | tetap mempertahankan. mencoba beradaptasi.,K,Ekstrovert,,
84, Saya belajar setelah mandi setelah habis maghrib  dan Lebih suka belajar sendiri dengan di temani series atau lagu karna menurut  saya mereka bicara tapi tidak mengajak saya bicara jadi saya bisa fokus dan tidak merasa kesepian | Saya lebih suka belajar menggunakan 1 orang atau video penjelasan dan langsung mempraotekan dengan mengulang soal yang di jelaskan di video | Dengan menonton series di tempat yang sepi dan hanya spotify dan series yang menemeanu | Mencari video materi serupa lalu mencocokanya dengan google lens jika salah mengulangi lagi sampai benar | Awalnya saya akan bersosialisasi lalu ber adaptasi ,K,Ekstrovert,,
85,lebih suka belajar sendiri karena tenang | lebih suka lewat penjelasan orang | lebih suka suasana sepi agar otak tidak gampang terdistrek | kadang suka minta bantuan suka menyelesaikan sendiri | suka kalau lingkungannya positif,K,Ekstrovert,,
86,"Saya biasanya belajar di sudut kamar yang sepi, paling sering saat larut malam ketika semua orang sudah tidur dan suasana benar-benar hening. Saya sangat butuh lingkungan yang tenang tanpa gangguan suara atau visual agar bisa benar-benar fokus memikirkan sesuatu secara mendalam.Bagi saya, belajar sendiri jauh lebih nyaman daripada dalam kelompok. Belajar sendirian menghemat energi sosial saya dan memberi saya kebebasan penuh untuk mengatur kecepatan memahami materi tanpa perlu berbasa-basi atau merasa tertekan oleh kehadiran orang lain. | Saya biasanya memahami materi baru melalui belajar mandiri. Langkah pertama yang saya lakukan adalah membaca materi secara menyeluruh dalam suasana tenang agar bisa mencerna setiap detail tanpa gangguan. Setelah itu, saya akan membuat catatan ringkas atau peta konsep dengan bahasa saya sendiri untuk memastikan logika penyampaiannya sudah saya kuasai.Saya lebih suka belajar sendiri dibandingkan berdiskusi karena metode ini memberi saya ruang untuk berpikir mendalam dan mencari referensi tambahan sesuai kecepatan belajar saya. Dengan belajar mandiri, saya bisa lebih fokus merenungkan materi hingga benar-benar merasa paham sebelum berinteraksi dengan orang lain. | Kondisi belajar yang paling saya sukai adalah suasana yang tenang dan sunyi, seperti di dalam kamar atau sudut perpustakaan yang sepi. Di sekitar saya biasanya hanya ada laptop, buku catatan, dan segelas air putih. Lingkungan yang minimalis dan tanpa kebisingan sangat membantu saya untuk mencapai fokus maksimal.Suasana tenang sangat cocok bagi saya karena saya adalah tipe orang yang mudah terdistraksi oleh suara atau pergerakan orang di sekitar. Saya merasa jauh lebih bersemangat dan produktif saat berada di lingkungan yang sunyi, karena keramaian cenderung menguras energi mental saya dan membuat pikiran sulit terkonsentrasi. | Saat menghadapi kesulitan belajar, langkah pertama yang saya lakukan adalah mencoba menyelesaikannya sendiri terlebih dahulu. Saya biasanya mencari referensi tambahan melalui buku, video pembelajaran di YouTube, atau artikel di internet untuk mendapatkan perspektif yang berbeda. Jika saya masih merasa buntu, saya akan meminta bantuan kepada teman atau guru yang lebih memahami materi tersebut.Saya lebih memilih mencoba sendiri di awal karena proses tersebut membantu saya mengasah kemampuan berpikir kritis dan kemandirian. Namun, saya juga menyadari batasan diri dan tidak ragu untuk berdiskusi dengan orang lain agar pemahaman saya menjadi lebih komprehensif. | Melalui pengalaman belajar selama ini, saya menyadari bahwa saya adalah tipe pelajar yang membutuhkan target yang jelas untuk tetap termotivasi. Saya belajar bahwa konsistensi jauh lebih efektif daripada belajar dengan sistem kebut semalam. Hal yang ingin saya pertahankan adalah kebiasaan mencatat poin-poin penting, namun saya ingin mengubah kecenderungan menunda pekerjaan agar manajemen waktu saya menjadi lebih baik.Saat berada di lingkungan belajar yang baru, saya cenderung bersikap terbuka, suportif, dan adaptif. Saya berusaha mengamati budaya belajar di lingkungan tersebut dan aktif menjalin komunikasi dengan rekan-rekan baru agar proses adaptasi berjalan lebih cepat dan harmonis.",K,Introvert,,
87,belajar bersamaa karna bisa punya relasi dan b | mandiri | belajar dimall dicaffe ditaman sangat membantu merefleksikan tubuh dan pikiran sayaa | tidak karnaa saya cenderung apa apa sendiri  | senangg happy,A,Ekstrovert,,
88,"orang lain, saya sulit mengerti jika belajar sendiri | mendengarkan penjelasan orang lain, saya merasa tidak ada perubahan jika saya belajar semdiri | tenang tapi asik, tidak terlau tegang tapi juga serius | mencoba menyelesaikan masalah itu sendiri lalu meminta bantuan orang lain | saya ingin lebih banyak blajar dan bisa mengatur waktu lebih baik. saya mungkin akan pilih pilih di lingkungan blajar yang baru tapi saya akan terbiasa",K,Ekstrovert,,
89,"saya biasanya sering belajar di rumah dan biasanya saya sering belajar jika mau ujian dan ulangan, suasana yg ada disekitarku saat ini yaitu senang, saya lebih nyaman belajar bersama org lain karena biar gak membosankan | biasanya saya baca berulang ulang sampai paham dan bertanya kepada teman  | saat semuanya tidak banyak bicara karena membuat saya menjadi fokus. | bertanya kepada guru dan teman serta mencari di internet, dan saya biasnaya sering menyelesaikan sendiri terlebih dahulu. | biasa saja, yg ingin saya ubah yaitu ingin lebih fokus terhadap pembelajaran, sikap saya saat berada di lingkungan belajar baru yaitu menjadi diem.",K,Ekstrovert,,
90,saya lebih suka belajar duskusi tapi syaa jga butuh beljaar sendiri agar materinya lebih paham  | pertama2 saya mendengarkan penjelasan orang tentng materi tersebut lalu saya serching di internet lalu saya harus beljar sendiri lagi sampai saya paham materi tsb | saya lebih suka suasana sepi tenang dingin tentram dan damai  | saya biasanya mencari dlu di internet lalu saya bertanya kepada teman agar lebih jelas | belajar lebih rajin dan niat agar materi lebih bisa dipahami,K,Ekstrovert,,
91,Saya senang belajar sendiri | Saya biasanya belajar sendiri di rumah | Saya senang belajar sendiri di malam hari karena suasana yang tenang | Saya lebih suka menyelesaikan masalah yang dihadapi sendiri karena saya lebih bisa melihat keadaan | Saya akan beradaptasi di lingkungan yang baru,K,Ekstrovert,,
